<?xml version="1.0" encoding="UTF-8" standalone="yes"?>
<!--W3C Schema generated by XMLSpy v2006 rel. 3 U (http://www.altova.com)-->
<xs:schema xmlns:xs="http://www.w3.org/2001/XMLSchema" elementFormDefault="qualified">
	<xs:element name="id">
		<xs:simpleType>
			<xs:restriction base="xs:string"/>
		</xs:simpleType>
	</xs:element>
	<xs:element name="name">
		<xs:simpleType>
			<xs:restriction base="xs:string"/>
		</xs:simpleType>
	</xs:element>
	<xs:element name="desc">
		<xs:simpleType>
			<xs:restriction base="xs:string"/>
		</xs:simpleType>
	</xs:element>
	<xs:element name="url">
		<xs:simpleType>
			<xs:restriction base="xs:string"/>
		</xs:simpleType>
	</xs:element>
	<xs:element name="icon">
		<xs:simpleType>
			<xs:restriction base="xs:string"/>
		</xs:simpleType>
	</xs:element>
	<xs:element name="website-module">
		<xs:complexType>
			<xs:sequence>
				<xs:element ref="module" maxOccurs="unbounded"/>
			</xs:sequence>
		</xs:complexType>
	</xs:element>
	
	<xs:element name="module">
		<xs:complexType>
			<xs:sequence>
				<xs:element ref="id"/>
				<xs:element ref="name"/>
				<xs:element ref="desc"/>
				<xs:element ref="url"/>
				<xs:element ref="icon"/>
			</xs:sequence>
		</xs:complexType>
	</xs:element>
</xs:schema>
